{
    "id":  "CA-E5-402",
    "path":  "policies/e5/CA-E5-402.user-risk-requires-password-change.json",
    "target":  {
                   "includeGroupNames":  [
                                             "CA-Tier-E5"
                                         ]
               },
    "grantControls":  {
                          "builtInControls":  [
                                                  "mfa",
                                                  "passwordChange"
                                              ],
                          "operator":  "AND"
                      },
    "tier":  "e5",
    "optional":  false,
    "conditions":  {
                       "clientAppTypes":  [
                                              "all"
                                          ],
                       "applications":  {
                                            "includeApplications":  [
                                                                        "All"
                                                                    ]
                                        },
                       "userRiskLevels":  [
                                              "high"
                                          ]
                   },
    "displayName":  "CA-E5-402 - User Risk Requires Password Change"
}

