{
    "id":  "CA-MG-103",
    "path":  "policies/managed/CA-MG-103.require-managed-device-for-sensitive-apps.json",
    "target":  {
                   "includeGroupNames":  [
                                             "CA-Tier-P1-Managed"
                                         ]
               },
    "grantControls":  {
                          "builtInControls":  [
                                                  "block"
                                              ],
                          "operator":  "OR"
                      },
    "tier":  "managed",
    "optional":  false,
    "conditions":  {
                       "clientAppTypes":  [
                                              "all"
                                          ],
                       "platforms":  {
                                         "includePlatforms":  [
                                                                  "windows"
                                                              ]
                                     },
                       "devices":  {
                                       "deviceFilter":  {
                                                            "rule":  "(device.trustType -ne \"AzureAD\") and (device.trustType -ne \"ServerAD\")",
                                                            "mode":  "include"
                                                        }
                                   },
                       "applications":  {
                                            "includeApplications":  [
                                                                        "Office365"
                                                                    ]
                                        }
                   },
    "displayName":  "CA-MG-103 - Block Unmanaged Windows Devices for Sensitive Apps"
}

